<computerStore
        xmlns:xsi="http://www.w3.org/2001/XMLSchema-instance"
        xsi:noNamespaceSchemaLocation="../XMLSchema/schema.xsd"
>
    <storeInfo>
        <storeName>PC Components</storeName>
        <location>
            <city>Русе</city>
            <address>бул. Свобода 9</address>
        </location>
        <contactNumber>+359 82 876 543</contactNumber>
    </storeInfo>
    <partCategories>
        <category>
            <name>Захранване</name>
            <subcategories>
                <subcategory>
                    <name>Modular</name>
                </subcategory>
                <subcategory>
                    <name>Semi-Modular</name>
                </subcategory>
                <subcategory>
                    <name>Non-Modular</name>
                </subcategory>
            </subcategories>
        </category>
    </partCategories>
    <products>
        <product productID="p1">
            <productName>Cooler Master MWE 650W</productName>
            <category>Захранване</category>
            <price>75.00</price>
            <description>Мощно и надеждно захранване за геймърски системи</description>
            <specifications>
                <specification>
                    <key>Мощност</key>
                    <value>650W</value>
                </specification>
                <specification>
                    <key>Тип</key>
                    <value>Modular</value>
                </specification>
                <specification>
                    <key>Ефективност</key>
                    <value>80+ Bronze</value>
                </specification>
            </specifications>
        </product>
    </products>
</computerStore>
